Recency,Frequency,Monetary,Count,labels,Nhận xét
351.3789,3.17094,15.37823,351,0,"khách hàng rời bỏ/không hoạt động, tiềm năng tăng sales rất thấp"
39.00149,13.35075,116.8873,670,1,"khách hàng VIP hiện tại, mang lại giá trị lớn, cần chăm sóc đặc biệt"
340.0471,8.957471,56.88254,870,2,khách hàng dễ rời bỏ
177.5212,13.15377,118.642,989,3,"khách hàng VIP, nhóm vàng, cần duy trì sự trung thành"
94.2961,7.067103,50.48943,811,4,"khách hàng phổ thông, có tiềm năng để phát triển thêm"
6.57563,10.89498,89.96164,238,5,khách hàng trung thành
